{
  "status": "draft",
  "medicine": [
    {
      "name_bn": "<অনুমোদিত নাম>",
      "active_ingredient": "<verified>",
      "dose_bn": "<verified dose>",
      "interval_bn": "<verified interval>",
      "pre_harvest_interval_days": null
    }
  ],
  "source": "DEV SEED: not reviewed, never ship",
  "reviewed_by": "",
  "reviewed_at": "",
  "id": "rice_blast",
  "crop": "rice",
  "name_bn": "ধানের ব্লাস্ট রোগ",
  "name_en": "Rice blast",
  "ai_hint_en": "Eye- or spindle-shaped leaf lesions with grey centres and brown borders; nodes or the panicle neck may turn dark and break.",
  "description_bn": "ব্লাস্ট ধানের একটি ছত্রাকজনিত রোগ। এটি পাতা, গিঁট ও ছড়ায় আক্রমণ করে এবং ফলন অনেক কমিয়ে দিতে পারে।",
  "symptoms_bn": [
    "পাতায় চোখের মতো বা টাকুর আকৃতির দাগ, মাঝখান ধূসর ও কিনারা বাদামি",
    "গিঁট বা ছড়ার গোড়া কালো হয়ে ভেঙে যেতে পারে",
    "মারাত্মক আক্রমণে পুরো পাতা শুকিয়ে যায়"
  ],
  "cause_bn": "ম্যাগনাপোর্থে নামের ছত্রাক। মেঘলা আবহাওয়া, বেশি আর্দ্রতা ও অতিরিক্ত ইউরিয়া সারে রোগ বাড়ে।",
  "urgency": "high",
  "immediate_bn": [
    "আক্রান্ত জমিতে ইউরিয়া সার দেওয়া বন্ধ রাখুন",
    "কৃষি কর্মকর্তার পরামর্শ নিন"
  ],
  "prevention_bn": [
    "রোগ সহনশীল জাতের বীজ ব্যবহার করুন",
    "সুষম মাত্রায় সার দিন",
    "জমি আগাছামুক্ত রাখুন"
  ],
  "see_expert": true
}
